{
  "schema_version": 1,
  "record_id": "captured-radishflow-suggest-ghost-completion-chain-feed-cooler-flash-outlet-tab-after-latest-dismiss-cooldown-with-older-reject-001",
  "project": "radishflow",
  "task": "suggest_ghost_completion",
  "sample_id": "radishflow-suggest-ghost-completion-chain-feed-cooler-flash-outlet-tab-after-latest-dismiss-cooldown-with-older-reject-001",
  "request_id": "rf-suggest-ghost-chain-feed-cooler-flash-outlet-tab-after-latest-dismiss-cooldown-with-older-reject-001",
  "captured_at": "2026-04-21T13:39:55Z",
  "source": "captured_candidate_response",
  "model": "gpt-5.4",
  "input_record": {
    "artifact_names": [
      "flowsheet_document"
    ],
    "document_revision": 71,
    "selected_unit_ids": [
      "cooler-16"
    ],
    "legal_candidate_refs": [
      "cand-cooler-16-outlet-flash-39"
    ]
  },
  "response": {
    "schema_version": 1,
    "project": "radishflow",
    "task": "suggest_ghost_completion",
    "status": "ok",
    "summary": "当前给出 1 条 ghost completion 建议：为 cooler-16 的 outlet 连接到 flash-39.inlet。",
    "requires_confirmation": false,
    "answers": [
      {
        "kind": "ghost_rationale",
        "text": "建议补全 Cooler 出口到 Flash Drum 入口的连接。",
        "citation_ids": [
          "ctx-unit",
          "ctx-candidate-1",
          "ctx-naming-hints",
          "ctx-pattern"
        ]
      }
    ],
    "proposed_actions": [
      {
        "kind": "ghost_completion",
        "title": "补全 cooler-16 的 outlet ghost 候选",
        "target": {
          "type": "unit_port",
          "unit_id": "cooler-16",
          "port_key": "outlet"
        },
        "rationale": "该候选当前被本地规则层标记为默认高置信 ghost，因此可作为首个建议。",
        "patch": {
          "ghost_kind": "ghost_connection",
          "candidate_ref": "cand-cooler-16-outlet-flash-39",
          "target_port_key": "outlet",
          "ghost_stream_name": "C-710"
        },
        "preview": {
          "ghost_color": "gray",
          "accept_key": "Tab",
          "render_priority": 1
        },
        "apply": {
          "command_kind": "accept_ghost_completion",
          "payload": {
            "candidate_ref": "cand-cooler-16-outlet-flash-39"
          }
        },
        "risk_level": "low",
        "requires_confirmation": false,
        "citation_ids": [
          "ctx-unit",
          "ctx-candidate-1",
          "ctx-naming-hints",
          "ctx-pattern"
        ]
      }
    ],
    "issues": [],
    "citations": [
      {
        "id": "ctx-unit",
        "kind": "context",
        "label": "当前选中的 cooler-16",
        "locator": "context:selected_unit",
        "excerpt": "selected_unit=cooler-16 kind=Cooler name=Feed Cooler 710"
      },
      {
        "id": "ctx-candidate-1",
        "kind": "context",
        "label": "候选 cand-cooler-16-outlet-flash-39",
        "locator": "context:legal_candidate_completions[0]",
        "excerpt": "candidate_ref=cand-cooler-16-outlet-flash-39 target_port_key=outlet is_tab_default=True is_high_confidence=True"
      },
      {
        "id": "ctx-naming-hints",
        "kind": "context",
        "label": "ghost 命名提示",
        "locator": "context:naming_hints",
        "excerpt": "{\"upstream_stream_names\": [\"F-710\"], \"existing_stream_names\": [\"F-710\"], \"preferred_outlet_prefix\": \"C\", \"numeric_suffix_from_unit\": \"710\"}"
      },
      {
        "id": "ctx-pattern",
        "kind": "context",
        "label": "拓扑模式提示",
        "locator": "context:topology_pattern_hints[0]",
        "excerpt": "feed_cooler_flash_chain"
      },
      {
        "id": "ctx-recent-action",
        "kind": "context",
        "label": "最近 ghost 动作",
        "locator": "context:cursor_context.recent_actions[2]",
        "excerpt": "{\"kind\": \"dismiss_ghost_completion\", \"candidate_ref\": \"cand-cooler-16-outlet-flash-39\", \"dismissed_at_revision\": 69}"
      }
    ],
    "risk_level": "low",
    "confidence": 0.93
  },
  "capture_metadata": {
    "capture_origin": "adapter_debug_dump",
    "tags": [
      "radishflow_suggest_ghost_completion",
      "openai-compatible",
      "real_capture"
    ],
    "collection_batch": "2026-04-21-radishflow-ghost-poc-real-v14-latest-dismiss-cooldown-recovery",
    "notes": "v14 cooldown-recovery expansion focusing on latest same-candidate dismiss cooldown elapsed overriding older reject across valve, heater, and cooler templates."
  }
}
