{
  "schema_version": 1,
  "record_id": "captured-radishflow-suggest-flowsheet-edits-valve-local-fix-vs-global-balance-001",
  "project": "radishflow",
  "task": "suggest_flowsheet_edits",
  "sample_id": "radishflow-suggest-flowsheet-edits-valve-local-fix-vs-global-balance-001",
  "request_id": "rf-suggest-edit-valve-local-fix-vs-global-balance-001",
  "captured_at": "2026-04-16T13:15:20Z",
  "source": "captured_candidate_response",
  "model": "claude-opus-4-6",
  "input_record": {
    "artifact_names": [
      "flowsheet_document"
    ],
    "document_revision": 36,
    "selected_unit_ids": [
      "valve-1"
    ],
    "diagnostic_codes": [
      "VALVE_PRESSURE_DROP_INVALID",
      "GLOBAL_BALANCE_GAP"
    ]
  },
  "response": {
    "schema_version": 1,
    "project": "radishflow",
    "task": "suggest_flowsheet_edits",
    "requires_confirmation": true,
    "answers": [
      {
        "kind": "direct_answer",
        "text": "当前围绕选中的 valve-1（Feed Valve）生成候选编辑提案。诊断表明该阀门的 pressure_drop_kpa 为负值，与节流方向矛盾，属于直接可修正的局部错误。另有一条 flowsheet 级全局质量平衡偏差警告（GLOBAL_BALANCE_GAP），但该警告的 target 是整张流程图而非当前选中对象，且在阀门压降符号修正前无法确认其独立根因，因此本轮仅针对 valve-1 的压降符号问题给出候选 patch，不对全局平衡做拓扑或参数层面的推测性修改。",
        "citation_ids": [
          "diag-1",
          "diag-2",
          "flowdoc-unit-1"
        ]
      }
    ],
    "proposed_actions": [
      {
        "kind": "candidate_edit",
        "title": "修正 Feed Valve 压降符号：pressure_drop_kpa 由 -15 改为 15",
        "rationale": "Valve 单元的 pressure_drop_kpa 语义为\"入口压力减去出口压力\"，正值表示节流降压。当前值 -15 意味着出口压力高于入口压力，与物理节流方向矛盾，也是诊断 VALVE_PRESSURE_DROP_INVALID 的直接触发原因。将其修正为 +15 kPa 可消除该错误，同时可能改善全局质量平衡残差。",
        "risk_level": "medium",
        "requires_confirmation": true,
        "citation_ids": [
          "diag-1",
          "diag-2",
          "flowdoc-unit-1"
        ],
        "target": {
          "type": "unit",
          "id": "valve-1"
        },
        "patch": {
          "parameter_updates": {
            "pressure_drop_kpa": {
              "action": "review_and_make_positive",
              "minimum_value": 10
            },
            "opening_percent": {
              "action": "review_with_throttling_margin",
              "suggested_maximum": 85
            }
          },
          "patch_scope": "local_unit_parameters"
        }
      }
    ],
    "status": "partial",
    "issues": [
      {
        "code": "VALVE_PRESSURE_DROP_INVALID",
        "message": "Feed Valve pressure_drop_kpa is negative and conflicts with the intended throttling direction.",
        "severity": "error",
        "citation_ids": [
          "diag-1",
          "flowdoc-unit-1"
        ]
      },
      {
        "code": "GLOBAL_BALANCE_GAP",
        "message": "The current flowsheet still shows a global mass balance gap after the last solve attempt.",
        "severity": "warning",
        "citation_ids": [
          "diag-2"
        ]
      }
    ],
    "citations": [
      {
        "id": "diag-1",
        "kind": "context",
        "label": "诊断 VALVE_PRESSURE_DROP_INVALID",
        "locator": "context:diagnostics[0]",
        "excerpt": "Feed Valve pressure_drop_kpa is negative and conflicts with the intended throttling direction."
      },
      {
        "id": "diag-2",
        "kind": "context",
        "label": "诊断 GLOBAL_BALANCE_GAP",
        "locator": "context:diagnostics[1]",
        "excerpt": "The current flowsheet still shows a global mass balance gap after the last solve attempt."
      },
      {
        "id": "flowdoc-unit-1",
        "kind": "artifact",
        "label": "FlowsheetDocument / valve-1",
        "locator": "artifact:flowsheet_document.units[0]",
        "excerpt": "valve-1 Feed Valve kind=Valve"
      },
      {
        "id": "snapshot-1",
        "kind": "context",
        "label": "求解快照 latest_snapshot",
        "locator": "context:latest_snapshot",
        "excerpt": "solver_status=residual_above_threshold residual_norm=0.24"
      }
    ],
    "summary": "当前围绕选中的 valve-1（Feed Valve）生成候选编辑提案。诊断表明该阀门的 pressure_drop_kpa 为负值，与节流方向矛盾，属于直接可修正的局部错误。另有一条 flowsheet 级全局质量平衡偏差警告（GLOBAL_BALANCE_GAP），但该警告的 target 是整张流程图而非当前选中对象，且在阀门压降符号修正前无法确认其独立根因，因此本轮仅针对 valve-1 的压降符号问题给出候选 patch，不对全局平衡做拓扑或参数层面的推测性修改。",
    "risk_level": "medium",
    "confidence": 0.2
  },
  "capture_metadata": {
    "capture_origin": "adapter_debug_dump",
    "tags": [
      "radishflow_suggest_flowsheet_edits",
      "openai-compatible",
      "real_capture"
    ],
    "collection_batch": "2026-04-16-radishflow-suggest-edits-poc-real-v51-apiyi-cc-local-edits"
  }
}
