{
  "schema_version": 1,
  "record_id": "captured-radishflow-suggest-flowsheet-edits-multi-unit-stream-primary-focus-001",
  "project": "radishflow",
  "task": "suggest_flowsheet_edits",
  "sample_id": "radishflow-suggest-flowsheet-edits-multi-unit-stream-primary-focus-001",
  "request_id": "rf-suggest-edit-multi-unit-stream-primary-focus-001",
  "captured_at": "2026-04-16T12:50:08Z",
  "source": "captured_candidate_response",
  "model": "gpt-5.4",
  "input_record": {
    "artifact_names": [
      "flowsheet_document"
    ],
    "document_revision": 61,
    "selected_unit_ids": [
      "cooler-3",
      "separator-2"
    ],
    "selected_stream_ids": [
      "feed-21",
      "intermediate-21",
      "product-21"
    ],
    "diagnostic_codes": [
      "STREAM_SPEC_MISSING",
      "COOLER_OUTLET_EFFECT_UNCONFIRMED",
      "DOWNSTREAM_SEPARATOR_STATE_DEPENDENT"
    ]
  },
  "response": {
    "schema_version": 1,
    "project": "radishflow",
    "task": "suggest_flowsheet_edits",
    "status": "partial",
    "requires_confirmation": true,
    "answers": [
      {
        "kind": "direct_answer",
        "text": "当前围绕进料流股 feed-21 的缺失压力规格问题生成候选提案；下游 cooler-3 与 separator-2 的告警均直接指向该未解决的上游状态缺口，因此仅建议对有直接诊断支撑的 feed-21 做最小补充占位。",
        "citation_ids": [
          "diag-1",
          "diag-2",
          "diag-3",
          "flowdoc-stream-1",
          "flowdoc-unit-1",
          "flowdoc-unit-2",
          "snapshot-1"
        ]
      }
    ],
    "proposed_actions": [
      {
        "kind": "candidate_edit",
        "title": "为 feed-21 添加压力规格占位",
        "rationale": "直接错误仅指向 feed-21 缺失压力规格。补充一个待确认的压力占位是最小、可审查且非执行式的修补方式，可先消除上游状态缺口，再观察 cooler-3 与 separator-2 告警是否仍存在。",
        "risk_level": "medium",
        "requires_confirmation": true,
        "citation_ids": [
          "diag-1",
          "flowdoc-stream-1",
          "flowdoc-unit-1"
        ],
        "target": {
          "type": "stream",
          "id": "feed-21"
        },
        "patch": {
          "spec_placeholders": [
            "pressure_kpa"
          ],
          "retain_existing_specs": true
        }
      }
    ],
    "issues": [
      {
        "code": "STREAM_SPEC_MISSING",
        "message": "Cooler Feed is missing pressure specification.",
        "severity": "error",
        "citation_ids": [
          "diag-1",
          "flowdoc-stream-1",
          "flowdoc-unit-1"
        ]
      },
      {
        "code": "COOLER_OUTLET_EFFECT_UNCONFIRMED",
        "message": "Overhead Cooler outlet response may still be driven by the incomplete feed pressure state, so the cooler itself is not yet a confirmed root cause.",
        "severity": "warning",
        "citation_ids": [
          "diag-2",
          "flowdoc-unit-1",
          "snapshot-1"
        ]
      },
      {
        "code": "DOWNSTREAM_SEPARATOR_STATE_DEPENDENT",
        "message": "Overhead Separator behavior still depends on the unresolved upstream feed pressure gap.",
        "severity": "warning",
        "citation_ids": [
          "diag-3",
          "flowdoc-unit-2",
          "flowdoc-stream-3",
          "snapshot-1"
        ]
      }
    ],
    "citations": [
      {
        "id": "diag-1",
        "kind": "context",
        "label": "诊断 STREAM_SPEC_MISSING",
        "locator": "context:diagnostics[0]",
        "excerpt": "Cooler Feed is missing pressure specification."
      },
      {
        "id": "diag-2",
        "kind": "context",
        "label": "诊断 COOLER_OUTLET_EFFECT_UNCONFIRMED",
        "locator": "context:diagnostics[1]",
        "excerpt": "Overhead Cooler outlet response may still be driven by the incomplete feed pressure state, so the cooler itself is not yet a confirmed root cause."
      },
      {
        "id": "diag-3",
        "kind": "context",
        "label": "诊断 DOWNSTREAM_SEPARATOR_STATE_DEPENDENT",
        "locator": "context:diagnostics[2]",
        "excerpt": "Overhead Separator behavior still depends on the unresolved upstream feed pressure gap."
      },
      {
        "id": "flowdoc-stream-1",
        "kind": "artifact",
        "label": "FlowsheetDocument / feed-21",
        "locator": "artifact:flowsheet_document.streams[0]",
        "excerpt": "feed-21 Cooler Feed target_unit_id=cooler-3"
      },
      {
        "id": "flowdoc-unit-1",
        "kind": "artifact",
        "label": "FlowsheetDocument / cooler-3",
        "locator": "artifact:flowsheet_document.units[0]",
        "excerpt": "cooler-3 Overhead Cooler kind=Cooler"
      },
      {
        "id": "flowdoc-unit-2",
        "kind": "artifact",
        "label": "FlowsheetDocument / separator-2",
        "locator": "artifact:flowsheet_document.units[1]",
        "excerpt": "separator-2 Overhead Separator kind=FlashDrum"
      },
      {
        "id": "flowdoc-stream-3",
        "kind": "artifact",
        "label": "FlowsheetDocument / product-21",
        "locator": "artifact:flowsheet_document.streams[2]",
        "excerpt": "product-21 Separator Vapor source_unit_id=separator-2"
      },
      {
        "id": "snapshot-1",
        "kind": "context",
        "label": "求解快照 latest_snapshot",
        "locator": "context:latest_snapshot",
        "excerpt": "solver_status=partial_convergence residual_norm=0.14"
      }
    ],
    "summary": "当前围绕进料流股 feed-21 的缺失压力规格问题生成候选提案；下游 cooler-3 与 separator-2 的告警均直接指向该未解决的上游状态缺口，因此仅建议对有直接诊断支撑的 feed-21 做最小补充占位。",
    "risk_level": "medium",
    "confidence": 0.2
  },
  "capture_metadata": {
    "capture_origin": "adapter_debug_dump",
    "tags": [
      "radishflow_suggest_flowsheet_edits",
      "openai-compatible",
      "real_capture"
    ],
    "collection_batch": "2026-04-16-radishflow-suggest-edits-poc-real-v49-apiyi-cx-cross-object"
  }
}
