{
  "schema_version": 1,
  "record_id": "captured-radishflow-suggest-flowsheet-edits-stream-spec-placeholder-001",
  "project": "radishflow",
  "task": "suggest_flowsheet_edits",
  "sample_id": "radishflow-suggest-flowsheet-edits-stream-spec-placeholder-001",
  "request_id": "rf-suggest-edit-stream-spec-001",
  "captured_at": "2026-04-13T13:55:44Z",
  "source": "captured_candidate_response",
  "model": "gpt-5.4",
  "input_record": {
    "artifact_names": [
      "flowsheet_document"
    ],
    "document_revision": 14,
    "selected_stream_ids": [
      "stream-1"
    ],
    "diagnostic_codes": [
      "STREAM_SPEC_MISSING"
    ]
  },
  "response": {
    "schema_version": 1,
    "project": "radishflow",
    "task": "suggest_flowsheet_edits",
    "status": "ok",
    "requires_confirmation": true,
    "answers": [
      {
        "kind": "direct_answer",
        "text": "当前围绕已选中的物流 stream-1 缺少温度规格这一问题生成候选提案，建议仅补充一个可审查的温度规格占位，不改动连接或其他对象。",
        "citation_ids": [
          "diag-1",
          "flowdoc-stream-1"
        ]
      }
    ],
    "citations": [
      {
        "id": "diag-1",
        "kind": "context",
        "label": "诊断 STREAM_SPEC_MISSING",
        "locator": "context:diagnostics[0]",
        "excerpt": "Feed Stream is missing temperature specification."
      },
      {
        "id": "flowdoc-stream-1",
        "kind": "artifact",
        "label": "FlowsheetDocument / stream-1",
        "locator": "artifact:flowsheet_document.streams[0]",
        "excerpt": "stream-1 Feed Stream target_unit_id=heater-1"
      }
    ],
    "proposed_actions": [
      {
        "kind": "candidate_edit",
        "title": "为 Feed Stream 补充温度规格占位",
        "rationale": "诊断直接指出该物流缺少温度规格；当前证据仅支持在已选中的 stream-1 上补充缺失规格，占位值待人工确认后再定。",
        "risk_level": "medium",
        "requires_confirmation": true,
        "citation_ids": [
          "diag-1",
          "flowdoc-stream-1"
        ],
        "target": {
          "type": "stream",
          "id": "stream-1"
        },
        "patch": {
          "spec_placeholders": [
            "temperature_c"
          ],
          "retain_existing_specs": true
        }
      }
    ],
    "issues": [
      {
        "code": "STREAM_SPEC_MISSING",
        "message": "Feed Stream is missing temperature specification.",
        "severity": "error",
        "citation_ids": [
          "diag-1",
          "flowdoc-stream-1"
        ]
      }
    ],
    "summary": "当前围绕已选中的物流 stream-1 缺少温度规格这一问题生成候选提案，建议仅补充一个可审查的温度规格占位，不改动连接或其他对象。",
    "risk_level": "medium",
    "confidence": 0.2
  },
  "capture_metadata": {
    "capture_origin": "adapter_debug_dump",
    "tags": [
      "radishflow_suggest_flowsheet_edits",
      "openai-compatible",
      "real_capture",
      "first-real-batch"
    ],
    "collection_batch": "2026-04-13-radishflow-suggest-edits-poc-real-v3"
  }
}
