{
  "schema_version": 1,
  "record_id": "captured-radishflow-suggest-flowsheet-edits-issue-ordering-confirmed-before-unconfirmed-001",
  "project": "radishflow",
  "task": "suggest_flowsheet_edits",
  "sample_id": "radishflow-suggest-flowsheet-edits-issue-ordering-confirmed-before-unconfirmed-001",
  "request_id": "rf-suggest-edit-issue-ordering-confirmed-before-unconfirmed-001",
  "captured_at": "2026-04-18T11:33:51Z",
  "source": "captured_candidate_response",
  "model": "gpt-5.4",
  "input_record": {
    "artifact_names": [
      "flowsheet_document"
    ],
    "document_revision": 72,
    "selected_unit_ids": [
      "heater-4"
    ],
    "selected_stream_ids": [
      "feed-13",
      "product-13"
    ],
    "diagnostic_codes": [
      "STREAM_SPEC_MISSING",
      "UNIT_PARAMETER_INCOMPLETE",
      "HEATER_OUTLET_EFFECT_UNCONFIRMED"
    ]
  },
  "response": {
    "schema_version": 1,
    "project": "radishflow",
    "task": "suggest_flowsheet_edits",
    "status": "partial",
    "requires_confirmation": true,
    "answers": [
      {
        "kind": "direct_answer",
        "text": "当前围绕已选中的进料流股 feed-13 与加热器 heater-4 的已明确缺失规格生成候选提案；对 product-13 仅保留为受上游未定条件影响的未确认问题，不直接提出改动。",
        "citation_ids": [
          "diag-1",
          "diag-2",
          "flowdoc-stream-1",
          "flowdoc-unit-1",
          "snapshot-1"
        ]
      }
    ],
    "proposed_actions": [
      {
        "kind": "candidate_edit",
        "title": "为 Cold Feed 补充流量规格占位",
        "rationale": "诊断直接指出 feed-13 缺少流量规格；在当前证据下，添加流量占位是最小且可审查的局部补全，不扩展到其他未被直接确认的条件。",
        "risk_level": "medium",
        "requires_confirmation": true,
        "citation_ids": [
          "diag-1",
          "flowdoc-stream-1"
        ],
        "target": {
          "type": "stream",
          "id": "feed-13"
        },
        "patch": {
          "spec_placeholders": [
            "flow_rate_kg_per_h"
          ],
          "retain_existing_specs": true
        }
      },
      {
        "kind": "candidate_edit",
        "title": "为 Balance Heater 补充出口温度目标占位",
        "rationale": "heater-4 已配置为 outlet_temperature 控制模式，但缺少对应目标值；补充目标参数占位与现有控制模式直接一致，且不涉及拓扑或执行式求解变更。",
        "risk_level": "medium",
        "requires_confirmation": true,
        "citation_ids": [
          "diag-2",
          "flowdoc-unit-1",
          "flowdoc-stream-2",
          "snapshot-1"
        ],
        "target": {
          "type": "unit",
          "id": "heater-4"
        },
        "patch": {
          "parameter_placeholders": [
            "outlet_temperature_c"
          ],
          "patch_scope": "unit_parameters",
          "preserve_existing_connections": true
        }
      }
    ],
    "issues": [
      {
        "code": "STREAM_SPEC_MISSING",
        "message": "Cold Feed is missing flow rate specification.",
        "severity": "error",
        "citation_ids": [
          "diag-1",
          "flowdoc-stream-1"
        ]
      },
      {
        "code": "UNIT_PARAMETER_INCOMPLETE",
        "message": "Balance Heater is configured for outlet temperature control but outlet temperature target is missing.",
        "severity": "error",
        "citation_ids": [
          "diag-2",
          "flowdoc-unit-1",
          "flowdoc-stream-2",
          "snapshot-1"
        ]
      },
      {
        "code": "HEATER_OUTLET_EFFECT_UNCONFIRMED",
        "message": "Heater Outlet temperature pattern may still be influenced by missing inlet conditions, and the local outlet effect is not yet confirmed.",
        "severity": "warning",
        "citation_ids": [
          "diag-3",
          "snapshot-1"
        ]
      }
    ],
    "citations": [
      {
        "id": "diag-1",
        "kind": "context",
        "label": "诊断 STREAM_SPEC_MISSING",
        "locator": "context:diagnostics[0]",
        "excerpt": "Cold Feed is missing flow rate specification."
      },
      {
        "id": "diag-2",
        "kind": "context",
        "label": "诊断 UNIT_PARAMETER_INCOMPLETE",
        "locator": "context:diagnostics[1]",
        "excerpt": "Balance Heater is configured for outlet temperature control but outlet temperature target is missing."
      },
      {
        "id": "diag-3",
        "kind": "context",
        "label": "诊断 HEATER_OUTLET_EFFECT_UNCONFIRMED",
        "locator": "context:diagnostics[2]",
        "excerpt": "Heater Outlet temperature pattern may still be influenced by missing inlet conditions, and the local outlet effect is not yet confirmed."
      },
      {
        "id": "flowdoc-stream-1",
        "kind": "artifact",
        "label": "FlowsheetDocument / feed-13",
        "locator": "artifact:flowsheet_document.streams[0]",
        "excerpt": "feed-13 Cold Feed target_unit_id=heater-4"
      },
      {
        "id": "flowdoc-unit-1",
        "kind": "artifact",
        "label": "FlowsheetDocument / heater-4",
        "locator": "artifact:flowsheet_document.units[0]",
        "excerpt": "heater-4 Balance Heater kind=Heater"
      },
      {
        "id": "flowdoc-stream-2",
        "kind": "artifact",
        "label": "FlowsheetDocument / product-13",
        "locator": "artifact:flowsheet_document.streams[1]",
        "excerpt": "product-13 Heater Outlet source_unit_id=heater-4"
      },
      {
        "id": "snapshot-1",
        "kind": "context",
        "label": "求解快照 latest_snapshot",
        "locator": "context:latest_snapshot",
        "excerpt": "solver_status=invalid_parameters"
      }
    ],
    "summary": "当前围绕已选中的进料流股 feed-13 与加热器 heater-4 的已明确缺失规格生成候选提案；对 product-13 仅保留为受上游未定条件影响的未确认问题，不直接提出改动。",
    "risk_level": "medium",
    "confidence": 0.2
  },
  "capture_metadata": {
    "capture_origin": "adapter_debug_dump",
    "tags": [
      "radishflow_suggest_flowsheet_edits",
      "openai-compatible",
      "real_capture"
    ],
    "collection_batch": "2026-04-18-radishflow-suggest-edits-poc-real-v64-apiyi-cx-default-selection-ordering",
    "notes": "开始补齐 default-selection-ordering 在 apiyi_cx 上的首轮正式真实 capture。"
  }
}
