{
  "schema_version": 1,
  "record_id": "captured-radishflow-suggest-ghost-completion-chain-feed-heater-flash-heater-outlet-001",
  "project": "radishflow",
  "task": "suggest_ghost_completion",
  "sample_id": "radishflow-suggest-ghost-completion-chain-feed-heater-flash-heater-outlet-001",
  "request_id": "rf-suggest-ghost-chain-feed-heater-flash-heater-outlet-001",
  "captured_at": "2026-04-23T13:29:24Z",
  "source": "captured_candidate_response",
  "model": "deepseek-chat",
  "input_record": {
    "artifact_names": [
      "flowsheet_document"
    ],
    "document_revision": 53,
    "selected_unit_ids": [
      "heater-2"
    ],
    "legal_candidate_refs": [
      "cand-heater-2-outlet-flash-14"
    ]
  },
  "response": {
    "schema_version": 1,
    "project": "radishflow",
    "task": "suggest_ghost_completion",
    "answers": [
      {
        "kind": "ghost_rationale",
        "text": "当前已识别到高置信度的候选补全：将 Feed Heater 601 的出口连接到 Flash Drum 601 的入口，建议使用 Tab 键直接接受。",
        "citation_ids": [
          "ctx-unit",
          "ctx-candidate-1",
          "ctx-naming-hints",
          "ctx-pattern"
        ]
      }
    ],
    "proposed_actions": [
      {
        "kind": "ghost_completion",
        "title": "补全 heater-2 的 outlet ghost 候选",
        "target": {
          "type": "unit_port",
          "unit_id": "heater-2",
          "port_key": "outlet"
        },
        "rationale": "该候选当前被本地规则层标记为默认高置信 ghost，因此可作为首个建议。",
        "patch": {
          "ghost_kind": "ghost_connection",
          "candidate_ref": "cand-heater-2-outlet-flash-14",
          "target_port_key": "outlet",
          "ghost_stream_name": "H-601"
        },
        "preview": {
          "ghost_color": "gray",
          "accept_key": "Tab",
          "render_priority": 1
        },
        "apply": {
          "command_kind": "accept_ghost_completion",
          "payload": {
            "candidate_ref": "cand-heater-2-outlet-flash-14"
          }
        },
        "risk_level": "low",
        "requires_confirmation": false,
        "citation_ids": [
          "ctx-unit",
          "ctx-candidate-1",
          "ctx-naming-hints",
          "ctx-pattern"
        ]
      }
    ],
    "status": "ok",
    "issues": [],
    "citations": [
      {
        "id": "ctx-unit",
        "kind": "context",
        "label": "当前选中的 heater-2",
        "locator": "context:selected_unit",
        "excerpt": "selected_unit=heater-2 kind=Heater name=Feed Heater 601"
      },
      {
        "id": "ctx-candidate-1",
        "kind": "context",
        "label": "候选 cand-heater-2-outlet-flash-14",
        "locator": "context:legal_candidate_completions[0]",
        "excerpt": "candidate_ref=cand-heater-2-outlet-flash-14 target_port_key=outlet is_tab_default=True is_high_confidence=True"
      },
      {
        "id": "ctx-naming-hints",
        "kind": "context",
        "label": "ghost 命名提示",
        "locator": "context:naming_hints",
        "excerpt": "{\"upstream_stream_names\": [\"F-601\"], \"existing_stream_names\": [\"F-601\"], \"preferred_outlet_prefix\": \"H\", \"numeric_suffix_from_unit\": \"601\"}"
      },
      {
        "id": "ctx-pattern",
        "kind": "context",
        "label": "拓扑模式提示",
        "locator": "context:topology_pattern_hints[0]",
        "excerpt": "feed_heater_flash_chain"
      },
      {
        "id": "ctx-recent-action",
        "kind": "context",
        "label": "最近 ghost 动作",
        "locator": "context:cursor_context.recent_actions[0]",
        "excerpt": "{\"kind\": \"accept_ghost_completion\", \"candidate_ref\": \"cand-feed-601-to-heater-2-inlet\", \"accepted_at_revision\": 52}"
      }
    ],
    "summary": "当前已识别到高置信度的候选补全：将 Feed Heater 601 的出口连接到 Flash Drum 601 的入口，建议使用 Tab 键直接接受。",
    "risk_level": "low",
    "requires_confirmation": false,
    "confidence": 0.93
  },
  "capture_metadata": {
    "capture_origin": "adapter_debug_dump",
    "tags": [
      "radishflow_suggest_ghost_completion",
      "openai-compatible",
      "real_capture",
      "remaining-foundation-and-conflict-basics"
    ],
    "collection_batch": "2026-04-23-radishflow-ghost-poc-real-v19-remaining-foundation-and-conflict-basics",
    "notes": "v19 remaining foundation and conflict basics expansion."
  }
}
