{
  "schema_version": 1,
  "record_id": "captured-radishflow-suggest-flowsheet-edits-selection-chronology-single-actionable-target-001",
  "project": "radishflow",
  "task": "suggest_flowsheet_edits",
  "sample_id": "radishflow-suggest-flowsheet-edits-selection-chronology-single-actionable-target-001",
  "request_id": "rf-suggest-edit-selection-chronology-single-actionable-target-001",
  "captured_at": "2026-04-18T11:57:28Z",
  "source": "captured_candidate_response",
  "model": "kimi-k2.5",
  "input_record": {
    "artifact_names": [
      "flowsheet_document"
    ],
    "document_revision": 68,
    "selected_unit_ids": [
      "separator-7",
      "heater-6",
      "cooler-7"
    ],
    "selected_stream_ids": [
      "vapor-44",
      "feed-44",
      "cooled-44",
      "heated-44"
    ],
    "diagnostic_codes": [
      "STREAM_SPEC_MISSING",
      "SEPARATOR_STATE_DEPENDENT",
      "HEATER_OUTLET_EFFECT_UNCONFIRMED",
      "COOLER_OUTLET_EFFECT_UNCONFIRMED"
    ]
  },
  "response": {
    "schema_version": 1,
    "project": "radishflow",
    "task": "suggest_flowsheet_edits",
    "status": "partial",
    "confidence": 0.85,
    "summary": "针对选中的 Recycle Cooler (cooler-7) 及其关联流股，基于诊断信息识别出上游 feed-44 压力规格缺失是核心阻塞点。当前 cooler-7 仅受下游影响而非根因，因此提案聚焦于为缺失压力的进料流股添加规格占位，以解除下游单元的级联不确定性。",
    "answers": [
      {
        "kind": "direct_answer",
        "text": "检测到 feed-44 缺少压力规格，这是导致 separator-7、heater-6 和 cooler-7 出现级联警告的根本原因。建议为 Recycle Feed 添加压力规格占位。",
        "citation_ids": [
          "diag-1",
          "flowdoc-stream-1",
          "snapshot-1"
        ]
      }
    ],
    "issues": [
      {
        "code": "STREAM_SPEC_MISSING",
        "message": "Recycle Feed (feed-44) 缺少压力规格，阻塞上游状态确定。",
        "severity": "error",
        "citation_ids": [
          "diag-1",
          "flowdoc-stream-1",
          "flowdoc-unit-1"
        ]
      },
      {
        "code": "SEPARATOR_STATE_DEPENDENT",
        "message": "Recycle Separator behavior still depends on the unresolved upstream feed pressure.",
        "severity": "warning",
        "citation_ids": [
          "diag-2",
          "flowdoc-unit-3",
          "flowdoc-stream-4",
          "snapshot-1"
        ]
      },
      {
        "code": "HEATER_OUTLET_EFFECT_UNCONFIRMED",
        "message": "Feed Trim Heater outlet response may still be influenced by the incomplete feed pressure state.",
        "severity": "warning",
        "citation_ids": [
          "diag-3",
          "flowdoc-unit-1",
          "snapshot-1"
        ]
      },
      {
        "code": "COOLER_OUTLET_EFFECT_UNCONFIRMED",
        "message": "Recycle Cooler 出口响应当前受未解析的上游压力缺口影响，但 cooler-7 本身并非根因。",
        "severity": "warning",
        "citation_ids": [
          "diag-4",
          "flowdoc-unit-2",
          "snapshot-1"
        ]
      }
    ],
    "proposed_actions": [
      {
        "kind": "candidate_edit",
        "title": "为 Recycle Feed 添加压力规格占位",
        "rationale": "feed-44 的压力规格缺失是诊断中唯一的 error 级别问题，直接导致 separator-7 的 SEPARATOR_STATE_DEPENDENT 警告以及 heater-6、cooler-7 的级联不确定性。通过添加 pressure_kpa 规格占位，可解除下游单元的依赖阻塞，使 cooler-7 的选中状态获得可审查的上下文。该修改仅补充缺失规格，不改变现有拓扑或求解行为。",
        "risk_level": "medium",
        "requires_confirmation": true,
        "citation_ids": [
          "diag-1",
          "flowdoc-stream-1",
          "flowdoc-unit-1"
        ],
        "target": {
          "type": "stream",
          "id": "feed-44"
        },
        "patch": {
          "spec_placeholders": [
            "pressure_kpa"
          ],
          "retain_existing_specs": true
        }
      }
    ],
    "citations": [
      {
        "id": "diag-1",
        "kind": "context",
        "label": "诊断 STREAM_SPEC_MISSING",
        "locator": "context:diagnostics[0]",
        "excerpt": "Recycle Feed is missing pressure specification."
      },
      {
        "id": "diag-2",
        "kind": "context",
        "label": "诊断 SEPARATOR_STATE_DEPENDENT",
        "locator": "context:diagnostics[1]",
        "excerpt": "Recycle Separator behavior still depends on the unresolved upstream feed pressure."
      },
      {
        "id": "diag-3",
        "kind": "context",
        "label": "诊断 HEATER_OUTLET_EFFECT_UNCONFIRMED",
        "locator": "context:diagnostics[2]",
        "excerpt": "Feed Trim Heater outlet response may still be influenced by the incomplete feed pressure state."
      },
      {
        "id": "diag-4",
        "kind": "context",
        "label": "诊断 COOLER_OUTLET_EFFECT_UNCONFIRMED",
        "locator": "context:diagnostics[3]",
        "excerpt": "Recycle Cooler outlet response is still downstream of the unresolved feed pressure gap, so the cooler itself is not yet a confirmed root cause."
      },
      {
        "id": "flowdoc-stream-1",
        "kind": "artifact",
        "label": "FlowsheetDocument / feed-44",
        "locator": "artifact:flowsheet_document.streams[0]",
        "excerpt": "feed-44 Recycle Feed target_unit_id=heater-6"
      },
      {
        "id": "flowdoc-unit-1",
        "kind": "artifact",
        "label": "FlowsheetDocument / heater-6",
        "locator": "artifact:flowsheet_document.units[0]",
        "excerpt": "heater-6 Feed Trim Heater kind=Heater"
      },
      {
        "id": "flowdoc-unit-3",
        "kind": "artifact",
        "label": "FlowsheetDocument / separator-7",
        "locator": "artifact:flowsheet_document.units[2]",
        "excerpt": "separator-7 Recycle Separator kind=FlashDrum"
      },
      {
        "id": "flowdoc-stream-4",
        "kind": "artifact",
        "label": "FlowsheetDocument / vapor-44",
        "locator": "artifact:flowsheet_document.streams[3]",
        "excerpt": "vapor-44 Recycle Separator Vapor source_unit_id=separator-7"
      },
      {
        "id": "flowdoc-unit-2",
        "kind": "artifact",
        "label": "FlowsheetDocument / cooler-7",
        "locator": "artifact:flowsheet_document.units[1]",
        "excerpt": "cooler-7 Recycle Cooler kind=Cooler"
      },
      {
        "id": "snapshot-1",
        "kind": "context",
        "label": "求解快照 latest_snapshot",
        "locator": "context:latest_snapshot",
        "excerpt": "solver_status=partial_convergence residual_norm=0.13"
      }
    ],
    "requires_confirmation": true,
    "risk_level": "medium"
  },
  "capture_metadata": {
    "capture_origin": "adapter_debug_dump",
    "tags": [
      "radishflow_suggest_flowsheet_edits",
      "openai-compatible",
      "real_capture"
    ],
    "collection_batch": "2026-04-18-radishflow-suggest-edits-poc-real-v68-apiyi-ch-default-selection-ordering",
    "notes": "继续补齐 default-selection-ordering 在 apiyi_ch 上的首轮正式真实 capture。"
  }
}
